,text,misogynous
3174,antm è diventato proprio un programma di merda porca puttana le modelle si sono tutte lamentate per l’editing malizioso che fanno quelli della produzione,0
3175,porca puttanA trovo foto ogni cinque secondi e non so quale sia più bella forse questa o quella di prima o quella di prima ancora o tutte sono confusA ?????? <URL>,0
3176,"io avrei piuttosto tirato 2 ceffoni a Benatia (IO LO AMO,QUA A UDINE LO VENERAVO) ma porca puttana non si interviene in quella maniera in area che se anche becchi la palla a velocità normale sembra un'entrata di karatè..con la moviola son brav",0
3177,PORCA PUTTANA LE STO INSULTANDO UNA AD UNA,0
3178,Porca puttana non mi sono mai cagata così tanto in mano. Il bello è che la strada era visibilissima e non ha nemmeno rallentato.,0
3179,"Non c'era rigore porca puttana,non lo ha toccato ha toccato la palla,lo avete capito o no e che… <URL>",0
3180,MA PORCA PUTTANA TROIA HAROLD EDOARDO STYLES TU SEI UN FOLLE UN FOLLE,0
3181,mamma non mi risponde porca puttana è l’unica che potrebbe capirmi in questo momento e invece non mi tocca stare con mio papà e patire le pene dell’inferno vaffanculo vaffanculo vaffanculo,0
3182,Porca puttana quant'è bello sono stata a lavoro tutto il tempo con l'ansia per sapere di che colore si vestiva,0
3183,E che Cazzo tu tifi inter porca Troia come protestate voi quando giocate contro la Juve. Allora dovete finire tutte le volte con 9 giocatori,0
3184,gli juevntini sono i primi maiali gays che cazzo vuoi che fanno sono delle cagne . la juve è merda e agnelli la testa di cazzo che cambia moglie ogni 5 scopate,0
3185,porca puttana ma cosi' coglioni li prendono alla Bocconi? pensavo meglio francamente...,0
3186,ma porca puttana anche tu,0
3187,"Un rigore inesistente? Ma porca puttana io me incavolo perché gli ha dato una ginocchiata sotto l' ascella è evidente, da dietro e se non lo faceva quello segnava mesa che non l' hanno capito.....e comunque ripeto io me incaz",0
3188,"Ehi Jules, devo ammettere che mi sei mancato parecchio in questi ultimi tempi.""""Ma porca puttana Luke, che cazzo stai dicendo? Sono tre giorni che stai al bancone a bere birra; non ti sei mai mosso da qui.""#unTemaAlGiorno #ilParticipio""",0
3189,"RT Ehi Jules, devo ammettere che mi sei mancato parecchio in questi ultimi tempi.""""Ma porca puttana Luke, che cazzo stai di…""",0
3190,ho realizzato solo ora che domani vedrò Lana porca puttana non ce la posso fare,0
3191,"Ad occhio e croce,una bella tappa della Tournée con Asia Argento in Irlanda",0
3192,Sì ma Twitter ha messo apposta lo strumento dei thread porca puttana,0
3193,"Porca puttana Mauri, non doveva finire così.Non doveva.Cazzo.Ma girerà mai per noi una cazzo di volta quella fottuta ruota?Sono fiero di questi ragazzi, comunque. Di tutti. Di chi ci ha creduto fino alla fine. E di chi continuerà a crederci.",0
3194,Ci provate proprio a farmi bestemmiare allora porca puttana,0
3195,Ho sognato di essere tornato nella mia vecchia scuola coi miei vecchi compagni e porca puttana che incubo,0
3196,MA VI FATE I CAZZI VOSTRI PORCA PUTTANA?? AVETE ROTTO LE PALLE FINITELA,0
3197,Ha anche offeso le donne gli è scappato una porca puttana..,0
3198,"<MENTION_4> <MENTION_5> speriamo che prendano provvedimenti, perchè jonathan ha offeso le donne dicendo porca puttana.",0
3199,"a Jonathan è scappata una offesa contro le donne, ha detto porca puttana...",0
3200,"che porca di quella puttana, se c’è un essrcizio che nessuno sa fare e la profe dice che se nessuno lo fa non lo conta CHE CAZZO LO FATE PORCA DI QUELLA TROIA?! SE NON PRENDERE 10 PER UNA VOLTA NON SUCCEDE NIENTE DIO P!!!!!!!!!",0
3201,"giusto, meglio fare una sceneggiata alla mario merola se si brucia qualche lampadina dello stadio ??? ma porca puttana è così difficile tacere?",0
3202,quando cazzo suona sta campanella porca puttana non ce la faccio più,0
3203,"Sono sicura che Jonathan uscirà pulito dopo che ha detto porca puttana, perchè le donne si possono offendere e i froci no..altro che parità di genere..",0
3204,"Ma che cazzo stai dicendo neuroleso che io gli americani e i sionisti li odio , ma che sei un fascistone di Merda ?",0
3205,"Nella galassia radical chic spunta una nuova moda: l'alberofilia (per eliminare le frontiere tra le specie: siamo sempre lì...). Da qui prende nuovo senso l'espressione figa di legno"" e la favola di Pinocchio. #sisalvichipuò<URL> <URL>",0
3206,"Indecente, lurida, schifosa trasmissione .... Non sapevano più dove mettere la lingua e su quale specchio arrampicarsi... E Cesari tira fuori il fermo immagine...#finoalconfine #ridicolifinoallafine",0
3207,Ma che cazzo dicono ma porca puttana ce la fanno <URL>,0
3208,Io non so che cazzo di problemi abbia la gente.Figa è come se mi stampassi una foto della waifu o di andrea e la tenessi lì ad ammirarlaE non mi devo incazzareMa che figa hai in testa,0
3209,Raga che casino ecco perché si è leggermente distaccato da martedì.Perché coso glielo ha detto porca puttana,0
3210,"Io vorrei davvero dire che non ho urlato nella parte finale, ma pORCA PUTTANA KIM HEECHUL CI MANCAVI SOLO TU #SuperJuniorLoSiento",0
3211,"mi viene da piangere per il nervoso porca puttana eva, ma so che posso farcela",0
3212,Bel film! La migliore interpretazione di Asia Argento.Gli hai dato un bel ruolo,0
3213,Porca di una troia impestata budella ladra schifosa. Che cazzo di problemi hai a non saper scrivere un messaggio normale?Mess 1) ciao Mess 2) come stai?Mess 3) stamani vado al lavoroMess 4) tu stai già lavorando? Mess 5) io sono già stancaMess 6) ho litigato con Gaetano,0
3214,"C'è gente come Shopenhauer che la penserebbe in modo diverso.Se Lei si dovesse trovare in uno stadio al Derby Roma Lazio e il tifoso della squadra avversaria le dicesse Taci Puttana"", anzi una tifosa della squadra avversar",0
3215,Ma quanti anni ancora dobbiamo pagare per quella maledetta coppa del 85 porco puttana che sfiga questa Champions porca di quella puttana,0
3216,Non lo so. So che io non mi permetterei mai di dire una cosa del genere a nessuno. E pretendo per me lo stresso trattamento. Purtroppo è proprio questa tolleranza che che ci sta facendo perdere tutti i valori. Se al ta,0
3217,Oh porca puttana troia.Il mio bias e il mio wrecker.Ma scherziamo?Mi sotterro. <URL>,0
3218,Ecco perché non deve esistere neanche il taci puttana. Non puoi tollerare il primo senza correre il rischio di arrivare al terzo. Mio modesto parere ovvio.,0
3219,"PORCA PUTTANA ODIO IL MAL DI DENTI, ORRIBILE ORRIBILE ORRIBILE CAZZO",0
3220,Ma stiamo scherzando davvero porca puttana,0
3221,PORCA PUTTANA O MIO DIDODODODODO NON VEDO L'ORA,0
3222,Porca puttana che sfiga...auguri allo steward,0
3223,"sofia, matteo e margherita sono a san donà ma porca puttana",0
3224,Quanto mi sono rotta il cazzo del liceo e dei favoritismi gratuiti porca puttana dovete crepare malissimo,0
3225,"Ma che pezzo di merda è uno che va a dare della puttana succhiacazzi"" ad una donna in DM, solo perchè è tifosa di un'altra squadra? Un pezzo di merda pure senza palle, perchè sa di essere una merda e non voleva mostrarsi in TL.Io ti avrei screenshottato STRONZO!""",0
3226,"RT Ma che pezzo di merda è uno che va a dare della puttana succhiacazzi"" ad una donna in DM, solo perchè è tifosa di un'altra squa…""",0
3227,"RT Indecente, lurida, schifosa trasmissione .... Non sapevano più dove mettere la lingua e su quale sp…",0
3228,"Porca puttana si straparla di stile Juve"": Agnelli si sfava in nome del calcio italiano, Allegri parla ancora del rigore sulla ciabattata di Cuadrado e Gigi rompe a merda con bidoni, Sprite e Patatine. Parliamo del nostro onore e del fatto che si debba giocare 180 min. E' meglio""",0
3229,Porca puttana guarda #Manolas cazzo ...,0
3230,Figa ma allora che cazzo tifi?Il benevento?,0
3231,TO BE CONTINUED COSAAAA?!? COSA PORCA PUTTANA,0
3232,porca puttana io ho già i complessi sto mangiando un po' di riso e piselli dopo che non mangio da ieri mattina ma no devono continuare ad abbassarmi l'autostima,0
3233,quando qualcuno fa commenti transfobici su fb e tu sai che non dovresti rispondere che poi arriverà la gente a rompere il cazzo a chiamarti sjw etc etc ma non riesci a stare zitta perchè porca puttana tiro fuori le lame,0
3234,"Porca puttana è piu che netto, altro che dubbio, è netto!",0
3235,che bomba porca puttana.,0
3236,Ma porca puttana!! Perché non fai giocare così la tua squadra in tutte le partite che contano cristo di un dio!! Ieri come hai fatto il 3-0 hai iniziato a fare quel gioco di merda che si vede in campionato invece di continuare a spingere!,0
3237,MA CHE CAZZO HA CREATO ZAYN PORCA TROIA. #LetMeMusicVideo,0
3238,"MAGARI tossisce come una bestia ed è una tosse da bronchite, SI SENTE Io davvero non voglio essere maleducata perchè comunque è un adulto ma porca puttana ti sputerei addosso",0
3239,"Porca puttana che palle, é l’unica cosa che posso dirti. Mi fate cadere i coglioni che non ho <URL>",0
3240,porca puttana sto fuori e non la posso ascoltare C'HO LA TACHICARDIA <URL>,0
3241,Porca puttana mi è caduto l'orologio e mi si è rotto ai lati,0
3242,??La voce porca puttana ?,0
3243,Segnalatelo sto figlio di una lurida schifosa... <URL>,0
3244,Ma porca puttana solo ora vi accorgete di collina,0
3245,Ho detto a mia mamma che non riesco a mangiare tanto e dopo poco mi sento piena e lei non mi vuole credere ma che cazzo ti devo dire se non ho problemi porca puttana,0
3246,"Porca puttana cosa gli stavamo combinando...Non so se lo ricordi, prima della finale Juve-Barca mi pare che avevamo parlato di Ulisse-Nessuno contro Polifemo...ti giuro che ieri mi è tornata in mente a un certo punto. Avremmo meritato, per tant",0
3247,porca puttana taemin che canta in spagnolo <URL>,0
3248,Bene! Spero che il messaggio arrivi al punto di riuscire a riformare il sistema scolastico! Non finirò mai di pubblicare video del genere! Porca PUTTANA siamo nel 2018... <URL>,0
3249,"io non ce la faccio più ad avere bambini in casa che urlano, fanno casino, distruggono cose e compagnia bella. non ho firmato la condanna al babysitteraggio dei nipoti, porca puttana. soprattutto mentre cerco di studiare per la maturità, ma questo non lo capisce nessuno",0
3250,Giuse sono incazzato a bestia giuro. Porca puttana Sandro l’anno scorso lo mettevamo in paragone con marcelo. Oggi se la gioca con molinaro,0
3251,In jam jam Jun dice solamente ‘baby play with me’ e ‘say my name’ E PORCA PUTTANA SE MI FA SENTIRE A DISAGIO È FOTTUTAMENTE ILLEGALE SOLO PER IL MODO IN CUI LO DICE,0
3252,Ma non vi fate schifo? Porca puttana <URL>,0
3253,"Doveva essere un porca puttana ma già rischiavo così, comunque dovrei ricordarmelo",0
3254,<MENTION_4> <MENTION_5> <MENTION_6> STAI ZITTA MERDA LEI È UNA GRANDE FIGA E LO SUCCHIA AD UN GRANDE ARBITRO INTERNAZIONALETE LO SUCCHI AD AGNELLI E CR7 TE LO METTE NEL CULO STAI MUTO A DIGRIGNARE I DENTI PUTTANA,0
3255,"Non so se mi stanno più sul cazzo quelli che si piazzano in piedi davanti ai posti vuoti, quelli che si piazzano davanti all’ingresso o quelli che non si siedono quando l’autOBUS È STRAPIENO PORCA PUTTANA SIEDITI NON CI STIAMO",0
3256,"Ma porca troia, si può essere d'accordo o meno su quel che ha detto (per me ha sbagliato) ma che cazzo c'incastra il luogo di nascita",0
3257,porca puttana ma perché mi viene un attacco d’ansia ora dio santo stava andando tutto così bene mi ammazzo,0
3258,VOGLIO QUELLE CARDS PORCA PUTTANA <URL>,0
3259,A porca puttana troia.Mi ero dimenticato della finale ?????,0
3260,MA PORCA PUTTANA TUTTO OGGI DOVETE FARE MADONNA,0
3261,@ manager di Louis che cazzo fai tutto il giorno esattamente invece di fare il tuo lavoro un bambino saprebbero promuovere Louis meglio di te porca puttana,0
3262,Porca puttana,0
3263,Ma voi date retta a uno che si spaccia per Berlusconi e che definisce il cancelliere tedesco “una culona inchiavabile”? Per inciso non sarei io. Chi è?#twitter,0
3264,questo sarebbe stato il rigore che ci avrebbe fatto vincere la champions porca puttana..,0
3265,Quale guerra? Di cosa parli? Molla il fiasco e vai a casa a dormire.,0
3266,Pompinaro vieni che ti sborro in bocca.. Ma va a ciapal endel cul,0
3267,"Spigatemi perché Cazzo devo affrontare uno che è in leggenda 2,se io sono in leggenda 3,è una farsa giocare così porca troia Cazzo!!!! <URL>",0
3268,"<MENTION_4> Ci sono più milanisti qui a commentare che noi juventini ?? che sfigati sti figli di troia adottati dalla Cina ?? - 28 6 anni scomparsi dal<MENTION_5> che conta,in Italia comparse e parlano ???",0
3269,?????✅finoalconfine✅porca puttana,0
3270,#Pomeriggio5 Barbara invidiosisdina che ci sia una naturale più tettona di lei,0
3271,Porca puttana tu hai ragione provvedo subito,0
3272,"RAGA IO TRA POCO URLO, MA PORCA PUTTANA COSA NON SONO #SuperJuniorLoSiento <URL>",0
3273,Tecnologia al suo meglio: mia mamma è a vedere la presentazione del nuovo libro di a Ferrara e io la guardo in diretta da Francoforte. Ne discuteremo stasera su facetime! <URL>,0
3274,Eh si io non so se attaccare la siria o no...perchè cerco le prove su facebook....ma porca puttana <URL>,0
3275,"Porca Puttana. Mi ricordo a scuola gente con la maglia del Liverpool, nei bar non potevi andare a prendere nemmeno un caffè. E' la cosa è durata per mesi di fila. <URL>",0
3276,Guarda wender che prendo sul serio la proposta che mi vuoi regalare la SMOANT....Non ti ho mai chiesto niente ..ne in radio ne da un altra parte ..quindi se non te ne fai niente e Paolo. Marco o chi svapa Non la vuole la prendo,0
3277,ahahahahha porca puttana,0
3278,"Certo che, porca puttana maiala setolata, nell'ultima azione facciamo una serie di errori da museo dell'orrore. Cazzo di un prete! #RealJuve",0
3279,Pirati dei Caraibi DMTNT:Ovviamente ci doveva essere quel finale lì.....Puttana chi ha inventato sti cazzo di personaggi femminili...Ma che cazzo c'entrava? Ma vaffanculo!Un bel film rovinato da un finale di sti cazzo di politically correct.Morite tutti!,0
3280,Cazzo se rende l idea così porca puttana,0
3281,Porca puttana troia questo non poteva tacere. Stagione finita. <URL>,0
3282,"Dico solo che è meglio non ripeta pubblicamente quel che pensava mia mamma di Barbareschi, ma evidentemente ci aveva visto giusto ?",0
3283,"Stiamo cercando di avere un fottuto governo di merda da cui non se ne esce più, TACI PORCA PUTTANA.",0
3284,"Quando camminate coi bambini dovete stare voi lato strada, che se (sia mai) succede qualcosa almeno colpisce voi e non loro PORCA PUTTANA SONO ESSERI INDIFESI NON ACCHIAPPALIKE PER LE FOTO SUI SOCIAL.",0
3285,Ma vai a quel paese ?❤️... No scherzo.... È il tuo compleanno.... Porca puttana Thomas.... Ho lo spettacolo domani e ho già tripla ansia(anche per il tuo compleanno) ... Ora ti ci metti pure con questo ??.... Ma che ti ho fatto di male? Io,0
3286,RT MA PORCA PUTTANA <URL>,0
3287,da anni non vedevo un terzino forte come marcelo umiliato così. che cazzo di giocatore puttana troia,0
3288,Porca puttana come vi siete ridotti ????????#ItaliaLovesMichaelOliver,0
3289,Orca Troia io pensavo fosse un cantante sedicenne di chissà che stato degli USA e invece porca puttana è l’arbitro Il cipresso non ha funzionato a quanto pare <URL>,0
3290,perché dovete sempre dubitare di me porca puttana troia,0
3291,Sta foto fa molto impressione porca puttana,0
3292,#piazzapulita ma che cazzo ti ridi? Questa è la conseguenza della merda di legge elettorale voluta da voi e forza italia!,0
3293,"Ma porca puttana, non ti rendi conto che gli hai fatto del male? Non so se ridere o cosa",0
3294,"Che poi nessuno lo dice o si preoccupa..chissà che minkia ha detto Buffon...immagino tipo...figlio di puttana che cazzo fai?""""",0
3295,Sì porca puttana,0
3296,"In palestra è partita kylie a bomba e porca puttana, non potete capire quant’è stato difficile non far partire un lip sync che dignità addio.",0
3297,"raga porca puttana, sono ritornata stasera dal campo scuola e FINALMENTE HO DI NUOVO INTERNET SI CAZZO",0
3298,porca puttana ma proprio con la mano sul cuore e con l'inno urlato <URL>,0
3299,Goal fallito goal subito dannata legge del calcio porca puttana #SalisburgoLazio,0
3300,e porca puttana sto cazzo di tumore #annieparker,0
3301,Ma porca puttana cosa cazzo sta combinando la Lazio,0
3302,Perché Luis Alberto è ancora in campo dopo quel gol mangiato porca puttana là l'abbiamo persa porca puttana #SalisburgoLazio,0
3303,Ma Porca Puttana non vorrai paragonare di Maio a Berlinguer cazzo a tutto c'è un limite,0
3304,a #tvoi la canzone ci sta tutta... ma pensate a quando l'ha cantata Ditemi se è la stessa lingua... porca puttana... ditemi se è la stessa lingua....,0
3305,Raga però porca puttana ora partono sfavoriti al derby...,0
3306,"Porca puttana se vincete il derby,che cazzo di settimana che vi fate.",0
3307,Che poi mi mancano le f(x) porca puttana.Mi mancano davvero tanto maledizione.,0
3308,porca puttana seriamente io ho cominciato a sentirmi uno schifo proprio a 15 anni if this ain't me <URL>,0
3309,mi sono nati due (2) brufolazzi porcaccia la puttana lurida,0
3310,Dacci un po' di figa Renga! Che cazzo ce ne dobbiamo fare della schedina? #TVOI,0
3311,E NON SONO COREANA E NON HO SOLDI PER ANDARE LÀ E FARE QUEL CAZZO CHE VOGLIOCerto non ho fatto altro che supportarlo ma PORCA PUTTANA è tutto ciò che posso fare e farei di più se potessi ma non possoQuindi non mi rompete il cazzo che poi divento intrattabile twitter stan dc,0
3312,"#Piazzapulita Roma ha problemi, e' vero.... ma porca puttana sapete parlare solo di questo? per voi l'importante e' parlare male del M5S, che schifo di informazione.. ogni tanto cambiate citta' altrimenti e' evidente che vi pagano per sparlare solo di Roma...",0
3313,"RT #Piazzapulita Roma ha problemi, e' vero.... ma porca puttana sapete parlare solo di questo? per voi l'importante e' parl…",0
3314,Porca puttana mo come vivo <URL>,0
3315,#SalzburgLazio rialzarsi subito porca puttana,0
3316,Porco dio andate a zappare la terra porca puttana non si possono prendere 3 goal in 6 minuti 72/74/76 porco dio,0
3317,"PORCA PUTTANA,TOM APPENA HAI PIANTO TU SONO SCOPPIATA ANCH'IO????? Mi mancheranno tantissimo <URL>",0
3318,"Ho brividi alle braccia, alle gambe, ovunque. Il cuore che mi batte così forte. Porca puttana. Non ci capisco più un cazzo.",0
3319,"Zitti tutti??Ovvio...se nn scrivi in italiano in modo che tutti capiscano cosa dici,che cazzo devono obiettare!!! Ma io boh...? <URL>",0
3320,"PORCA PUTTANA, PERSINO IO CHE NON SONO JUNGKOOK STAN MI SENTO SFAMATA <URL>",0
3321,porca puttana la giornata è già iniziata male e vaffanculo,0
3322,<MENTION_4> No. Non tutte le mamme. Tutte quelle che hanno la fortuna di aver mantenuto il lavoro. Quindi di che parliamo? Ah beh certo le mamme disoccupate possono stare a casa a badare ai figli. Peccato che poi non poss,0
3323,"ogni volta porca puttana e mo basta, fino ad oggi non gli ho detto un cazzo perché porello mi fa tenerezza, la prossima volta me lo inculo a sangue.",0
3324,"Sono combattuta tra il porca vacca vieni qua che ti stupro"" e l' ""ommiodio sei talmente carino che mi viene il diabete solo a guardarti"" ?Ditemi che non sono l'unica con sti problemi mentali vi prego ahahaha ?#BTS #Jungkook #ARMY #BTSARMY <URL>",0
3325,"Raga porca puttana sta canzone merita un casino GUARDATE IL VIDEO, COMPRATE LA CANZONE, ASCOLTATELA SU SPOTIFY. SI IMPEGNA UN CASINO LEI, DIAMOLE CIÒ CHE MERITA #100Grados <URL>",0
3326,Madonna se mai dovessero anche solo sfiorare Irene fossero anche in 20 mi parte un’adrenalina che faccio io la strage porca puttana <URL>,0
3327,Porca puttana mi è venuto un mezzo infarto ahahahah grazie ♥️,0
3328,Lui non ha mai cercato un contatto con me in 17 anni porca puttana e adesso spunta tutto all'improvviso con la voglia di fare il padre e mi sta anche bene eh ma se prova a usarmi per i soldi come ha fatto con mamma son capace di non guardarlo più in faccia,0
3329,"Mi rattrista molto essere considerata una figa di legno che se la tira, quando in realtà sono solo super timida :(",0
3330,ma che cazzo fanno..Chi sono questi demeriti ...E Nooooo .Sono matti a dir poco..Deve finire p.puttana!!!,0
3331,Porca puttana il nuovo direttore è uno di quelli che quando ti si avvicinano non si sente minimamente e mi ha già fatto prendere 3 infarti,0
3332,PORCA PUTTANA PORCAAAAAAA #LaCasaDiCarta,0
3333,Vai fare culo figlio di pompinara.Hai capito brutto bastardo.Segaiolo ahaha,0
3334,"Però porca puttana, mi alzo alle 7:34 e faccio “ solo altri 5 minuti”, mi sono risvegliato ora...",0
3335,"bitches in milaaaaan #Milan Figa, si fatturaaaaaaaaaa <URL>",0
3336,"Ma pure quella di quest'anno porca puttana.L'anno scorso quarta l'Atalanta con Petagna/Pinilla, l'anno prima la Fiorentina con Kalinic ecc",0
3337,"ma porca puttana, permettere ad un interista dichiarato di scrivere questa roba (offensiva) su un giornale nazionale? ma non si vergognano?",0
3338,porca puttana metti un fottuto emoticon che sembra che stai in guerra!!!!!!!!!!!!!!e comunque ti posso assicurare che tutto sembri tranne che ironico visto che mi chiedi la stessa cosa due volte....,0
3339,"Già il fatto che non mi hai dato del puttanone, è un gran traguardo ????",0
3340,MUOVETE IL CULO PORCA PUTTANA BON CE LA POSSO FARE,0
3341,Raga che cazzo hanno rubato il cell di mio padre e ci sono tutte foto mie sopra PORCA PUTTANA CHE ODIO,0
3342,Sto mese ho un mal di pancia assurdo che non sto in piedi porca puttana,0
3343,"Si però porca puttana. Non solo mi perdo un sabato libero, ma mi tocca pure fare straordinario, perdendomi un secondo sabato.",0
3344,chissa perché gli accusati di stupro e molestie se la cavano quasi sempre con il era consensuale. ci stava. se l'è cercata- è na troia intrigante- tanto che manco si denuncia. c'è la scadenza pure per farlo. non credo sia lo s,0
3345,Il Bayern. MA PORCA PUTTANA PERCHÉ,0
3346,questa me l'ero persa porca puttana,0
3347,Ho un sonno porca puttana guarda,0
3348,<MENTION_4> <MENTION_5> <MENTION_6> <MENTION_7> <MENTION_8> <MENTION_9> <MENTION_10> <MENTION_11> ahahah porca puttana sembra che parli seriamente anche di questo argomento...la tua necessità di arrivare al,0
3349,voi del 2000 non capite che fortuna avrete a fare la maturità senza questa cazzo di terza prova che porca puttana fra simulazioni e tutto il resto mi sparo,0
3350,"Porca puttana ho ancora la febbre a 38, non è possibile...",0
3351,"Porca puttana ho appena evitato per un pelo una mia ex compagna di scuola e non oso immaginare che conversazione sarebbe potuta uscireEh allora, non ci si sente da un sacco!""""ESATTO ED È UNA COSA VOLUTA PERCHÉ MI AVETE SEMPRE FATTO SCHIFO TUTTI QUANTI, comunque come va?""""",0
3352,"lo giuro certe volte è insopportabile, la grida sempre, la chiude fuori a casissimo, nessuno ti ha chiesto di stare qua porca puttana lascia il cane in pace",0
3353,RT Porca puttana ho appena evitato per un pelo una mia ex compagna di scuola e non oso immaginare che conversazione sareb…,0
3354,AVETE ROTTO IL CAZZO PORCA PUTTANA DI QUESTI FALSI DEL CAZZO,0
3355,E a giugno torno a Torino porca puttana ?♥️,0
3356,Mi manchi da morire. Porca puttana quando cazzo torni,0
3357,"l'incontro di ieri sera al con e Asia Argento. non una bellissima figura per l'Italia, va detto, però loro molto brave e appassionate <URL>",0
3358,Mia mamma: cazzo ma Claudia cosa combini???? Ma che cazzo???? Ma porca puttana!!!sempre mia mamma: dovevo dirgli che era una minch........ CAVOLATA,0
3359,pensa quanto ho fatto schifo per fare la tua stessa top porca puttana,0
3360,ho vinto dieci mesi di borsa di studio a breslaviaporca puttana,0
3361,"<MENTION_4> <MENTION_5> Maschio italiano.... quindi 30 milioni di copie in Italia sti uomini?! Magari chi critica Asia Argento è perché al contrario dei perbenismi come te, rispetta chi davvero ha subito stup",0
3362,Qualcuno mi spiega perché Wattpad segnala “SHIT” e non “PORCA PUTTANA TI UCCIDO LA FAMIGLIA BRUTTO FIGLIO DELLA MERDA”?,0
3363,Porca puttana che bello internet,0
3364,"porca puttana quanto sono demotivata, riuscirò mai a vederti? mado",0
3365,"Su CC mi arrivano messaggi anonimi con su scritto robe tipo Scopami"", ""Ti vedo e ho la figa bagnata"", ""Ti scoperei a sangue"" etcMa scusate, ma perché? Ma io mi vedo attraente come un bidone della raccolta differenziata. Ma cosa cazzzz mi scrivete?!""",0
3366,Come F definisce B:-un cucciolo di libellula-una bellissima farfallina-un'iguana delle savaneCome B definisce F:-Una puttanella-Balena spiaggiata-Brutta troietta-Stupida bitchIn tutto ciò ho capito che Fè è la troia della situazione..<MENTION_1>,0
3367,Ma porca puttana perché non riesco più a fare una cazzo di analisi narratologica c'ho i bruscolini al posto del cervello,0
3368,oggi nell’aria c’è un misto di porca puttana e perché a me,0
3369,I miei genitori e mia sorella non capiscono mai un cazzo. Io accetto volentieri l’aiuto di mia sorella ma come spiega lei quella merda è totalmente diverso dagli schemi della prof e in verifica io devo BASARMI sulle parole scritte dalla prof porca puttana non è difficile,0
3370,Ma no loro mi urlano contro e mi fanno piangere dal nervoso quindi addio chimica. Vaffanculo porca puttana,0
3371,CAZZO PORCA PUTTANA NON M ISMRTO BENE PER MIWNTE,0
3372,"hai la possibilità di lasciare un condannato col quale ti sei alleato, puoi ancora rimediare, forza fate fare questo salto in avanti all'italia molla il condannato, ma porca puttana quanto ci vuole a capirlo",0
3373,Eh...La prima è gia finita porca puttana!?,0
3374,PORCA PUTTANA IL LIPSYNC DI QUESTA PUNTATAAAAAAAAA <URL>,0
3375,porca puttana spero so riprenda subito cristo santo,0
3376,Vedere #RealMadridJuve a distanza di quasi 48 ore su #jtv fa ancora male ... porca puttana nn riesco più a dormire per questa beffa al 93esimo !!!,0
