,text,misogynous
1123,Che voglia di essere puttanone d’assalto come quelle due ♥️,1
1124,RT Sei una lurida Troia mai sazia <URL>,1
1125,ho deciso che finisco il processo da brava bambina poi se vado in galera avrò modo di conoscere chi la può SVENTRARE al posto mio in galera si fanno le amicizie GIUSTE per GIUSEPPINA la POMPINARA ora decidete VOI,1
1126,Il bel culone della mia fidanzata Tiziana <URL>,1
1127,"un vomito più che rigurgito, questo comunista assieme alla culona in6 anni è riuscito a quintuplicare il numero di poveri in italia",1
1128,"Pompinara di contea, più amata d’ogni dea",1
1129,labbra da pompinara,1
1130,il vitino da vespa mal si intona al culone da balena cit la sezione aurea #estate #bellezza,1
1131,Che spettacolo di culona vogliosa <URL>,1
1132,ti stupro la notte <URL>,1
1133,"sta zoccolaspero che gli si chiuda la figa a tal punto da non poter più nè pisciare nè prendere cazzi e neanche far fuoriuscire il ciclo mestruale, cosicchè le ritornerà tutto sopra e le esca dalla bocca e vomiti sangue",1
1134,Stiamo guardando #uominiedonne e mio marito fa: “da figa di legno a bacio chiunque passa è n’attimo”.???!!“C’ha preso gusto..”,1
1135,<MENTION_4> X dove!? Pompinara ????????♥♥,1
1136,Paola sempre tettona Non ci credo che stia lì di sua spontanea volontàPer me l'hanno pagata#GF15,1
1137,"Che fregna assurda la tettona mora, da scoparsela per giorni. #GrandeFratello #Paola",1
1138,"Sono troie, che a volte ci fanno del bene, mettendosi in ridicolo, a volte belle, altre no ma con bel culo o tette. Quel genere di donne a cui mai mostrerei di me niente se non.. beh ci siamo capiti.",1
1139,<MENTION_4> <MENTION_5> <MENTION_6> <MENTION_7> <MENTION_8> <MENTION_9> <MENTION_10> <MENTION_11> <MENTION_12> <MENTION_13> <MENTION_14> <MENTION_15> <MENTION_16> <MENTION_17> <MENTION_18> <MENTION_19> <MENTION_20>,1
1140,"Mia mamma mentre guarda il #gf15 : mamma mia quante troie! Nn hanno capito il senso della vita.. Vogliono solo apparire.."" Nn le è ancora chiaro il trash ? #adoro""",1
1141,"Questa qui è solo una pompinara degli spagnoli,vergognati e comincia a tifare per Valentino rossi — Cal Crutchlow è inglese però ? <URL>",1
1142,Ma chi? Per assomigliare ad un tossico e una pompinara???,1
1143,o ma ti stupro la sorella,1
1144,Ma stiamo scherzando ma non le rispondere ma non visualizzarla che cazzo ma cosa pensa che vieni dalle montagne del sapone che non capisci quando una è una stronza Troia ?!?! NE RA,1
1145,"Sei tu a dettare il loro comportamento nei tuoi confronti.Insomma Chiara, se pensano che sei zoccola, vuol dire che lo sei.Che fai adesso, non parli più con loro? Sei sempre col muso, non sorridi più. Te la tiri ora? Sei diventata una figa di legno tutto d'un tratto?",1
1146,sei bellissssssima il tuo gran bel culone e un opera d arte . Cosa ti farei!!! .,1
1147,siiiiiiiiiiiiiii ti sborro tutta,1
1148,ashley e la tettona in tl &gt;&gt;&gt;&gt;&gt;&gt;,1
1149,Verò i tuoi drammi umani non giustificano il pensiero anche lontano di fare le corna a quel gran pezzo di figa della tua ragazza.Sappilo gf15 veronica,1
1150,"Scusate, ma sto puttanone spagnolo chi è? #GF15",1
1151,CULONA POTENTE DEVI PROMUOVERE I TUOI NUOVI SINGOLI ALTRIMENTI SARÀ UNA STRAGE IN DISCESA E NON POSSIAMO PERMETTERCI UN FLOP DEL GENERE HAI CAPITO GOOOO LEGGENDA DEL RAP,1
1152,ormai oer me tu sei la tettona,1
1153,Uhmmm riiico culona....,1
1154,brutto fattone solonuo la chismo tettona,1
1155,Mmmm quel bel culone...te lo morderei...chiamami così facciamo un altro palco a tuo marito,1
1156,6 stupenda mesa cosi ti scoperei figa e culo metre lui si sega,1
1157,pensaci mia bella tettona! ??,1
1158,deve fare la figa di legno,1
1159,"che spettacolo, quanto mi scoperei questa bella tettona <URL>",1
1160,<MENTION_4> <MENTION_5> <MENTION_6> <MENTION_7> <MENTION_8> <MENTION_9> <MENTION_10> <MENTION_11> <MENTION_12> <MENTION_13> <MENTION_14> <MENTION_15> <MENTION_16> <MENTION_17> <MENTION_18> Te lo,1
1161,La culona inchiavabile c ha messo mesi e mesi per farne uno e mo sta a rompe i cojoni a noi?,1
1162,Che tettona pazzesca!!!! Buon marTETTEdi ??,1
1163,Ma no dai per fare il puttanone la maglietta di madonna no!!,1
1164,"ciao, pezzo di figa",1
1165,ma ti stupro ciao,1
1166,Ho voglia di una bella figa da scopare,1
1167,Bella Tettona favolosa!?,1
1168,"Mi spiace solo di non saper cantare. Perché il mio sogno, ora, sarebbe fare il cantante melodico da balera romagnola. Con una giacca di paillettes, il codone, ed una cantante tettona strizzata in un microabito che le evidenzia i rotoli, al mio fianco.Dio, la bellezza.",1
1169,<MENTION_3>_IT <MENTION_3>_FR <MENTION_3>_DE <MENTION_3>_ES <MENTION_3>_UK <MENTION_3>_NL <MENTION_9> Vorrei infilarci il cazzo dentro la tua bocca carnosa da pompinara bevila tutta la sborra calda che faccia da Troia,1
1170,Che gran Troia che sei...??,1
1171,"Dannata puttana ti brucio, essi mio complice. <URL>",1
1172,io la prenderei a calci in culo pompinara di merda le donne comuniste sanno usare la bocca solo x dire infamita'(a parte la loro tendenza naturale,1
1173,"Me ne basta una, e non necessariamente tettona. Cosa vuoi in cambio? A parle l'anima... :P",1
1174,"Ma va caca, sarei bellissima, mora con gli occhi azzurri e probabilmente tettona ?Rosica!",1
1175,la culona inchiavabile non la violenta nessuno. Germania: La crisi delle violenze sessuali commesse dai migranti continua a seminare terrore e distruzione <URL>,1
1176,Dio che troia che sei....Mi fai sborrare tantissimo...,1
1177,"Ma che, della culona? Da ridere proprio!!",1
1178,"Ma state zitta Troia di merda...tu e ttt quelli come te dovete praticamente"" MORIRE...???""",1
1179,"Ti potevi vedere la culona"" di Pippa. :( Tienilo da parte, tanto ne farà altri. Cmq william si chiama muntbatten-windsor. Credo sia quello il cognome.""",1
1180,Pippa... se sapesse quante me ne sono fatte su quel bel culone. Comunque Giannantonio Muntbatten-windsor suona bene dai ?,1
1181,Bella culona... Da sfondare...,1
1182,Ma il puttanone di fianco a Rush?,1
1183,- Pronto? Mi passa la culona?,1
1184,#mayerlin la #gocha solo gente seria #culona bella <URL>,1
1185,"Macché vergognati, Muori troia nera! <URL>",1
1186,Puttana eva troia bastarda laida lurida stronza lercia porca sgualdrina le cose che ti farei <URL>,1
1187,PUTTANA il coglione Petrucci ubriacone dw merda se la prende con manolas e salva l alcolizzato ddr dimme troia quanto vi allunga baldracca,1
1188,Bella Culona!?,1
1189,"Per staccare gli italiani dall’UE, non basta una spinta tettonica, basta una tettona qualunque",1
1190,Che due labbra da pompinara che ha,1
1191,ti sborro e poi ti piscio in bocca <URL>,1
1192,Che pompinara vieni privato fammi pompino,1
1193,ti faresti inculare dal mio cazzetto ??? ESIGO UNA RISPOSTA DALLA MIA PUTTANA <URL>,1
1194,Non vedo l’ora che Barbarella in diretta smascheri quella figa di legno di Mariana e che dica palesemente che di sono comportati tutti malissimo facendo una gran figura di merda. #gf15 <URL>,1
1195,RT Non vedo l’ora che Barbarella in diretta smascheri quella figa di legno di Mariana e che dica palesemente che di sono co…,1
1196,Bella Moretti Chica Culona Lela Star <URL>,1
1197,Si stava mandando video zozzi con una 18enne tettona magrissima,1
1198,Bella tettona,1
1199,"Bravissima, pompinara twitter",1
1200,Bella Culona!❤? <URL>,1
1201,"..non ho capito cosa hai scritto...ma confermo......Melania è un bel gran puttanone.....e se fossi un capo di stato, chiederei a trump di farci un giro!!!!",1
1202,Guarda che figlie di troie che cazzo vi mettete così vicino ma li fate respirare <URL>,1
1203,Sei bellissima bella tettona complimenti smak,1
1204,Ma come fa Sammy ad essere una puttanona e allo stesso tempo essere un angelo sceso in terra? <URL>,1
1205,"IO VORREI CAPIRE PERCHÉ NON FACCIO ALTRO CHE PENSARE A QUELLE TROIE.MA DIO MIO, DEVO STUDIARE, CHE CAZZO ME NE FREGA DI LOROAIUTO",1
1206,Se mi ospiti vengo lì e ti stupro anche,1
1207,Complimenti pompinara doc,1
1208,Sopratutto ... VIVA LA TETTONA NATURALE !! La plastica - in differenziata ! ?,1
1209,La Merkel lo ha silurato qualche anno fa non se lo ricorda ! Inizi a non fare il leccaculo della culona sarebbe già qualcosa,1
1210,Che figa che sei !!!! Ti scoperei,1
1211,"<MENTION_4> esatto vuole stare in europa ma non come suddito .della culona teutonica o del renzi ( sic !) francese ,hai capito capra .capra .capra.capra",1
1212,#losportellodiforum Angelo scappa da queste pazze sua sorella che Troia che manco sa se è suo figlio! Ma fatti i cazzi tuoi stronza acida deficiente,1
1213,Lei e' doppiamente una merda e pompinara avendo disonorato donne. Lei e' una vergonga per il genere umano. arrampicatrice sociale de me cojoni. #arrivista #pompinara,1
1214,Asia Argento Merda raccomandata inutile ignorante bestiale,1
1215,Asia Argento è una troia !! <URL>,1
1216,Baye ha detto ad Aida “TU SEI UNA CAGNA”<MENTION_1> #GF15,1
1217,"Tu sei una cagna"" - Baye DameQUESTO RAGAZZO DEVE ESSERE SQUALIFICATO IMMEDIATAMENTE #gf15""",1
1218,TI SPOSTO LE MUTANDINE TE LO METTO NELLA FIGA E TI SBORRO NEL CULETTO,1
1219,Lei e' doppiamente una merda e pompinara avendo disonorato le donne per quello che ha fatto ovvero fare i pompini a Weinstein per scalare nel mondo del cinema. #arrivista #pompinara #humanrefuse #asiaargentommer,1
1220,Bel culo bella figa,1
1221,"La paladina di sta fava. Colei che crede di rappresentare le vere donne che subirono e subiscono stupri. Giusto la poteva fare accoppiata con lei. Pudore asia argento, quello che lei mai ha conosciuto né ricono",1
1222,"... ASIA ARGENTO, NON È CHE SOFFRI DELLA SINDROME DELLA AMANTE/MOGLIE/DONNA RIPUDIATA ?? ... E FATTENE UNA RAGIONE, SALVINI NON TI CAGA PROPRIO !! ... ... (E POI, DETTO FRA DI NOI, .. VUOI METTERE, TU, E LA ISOARDI ?!!! ...",1
1223,"-Si posiziona davanti al frigo-esci in piscina tu e tutti i tuoi vestiti fino a domani mattinaAIDA HAI ROTTO IL CAZZO BASTA DAI -Devi vedere che culo che ha, mica sta roba di MERDAun pò di latticini che fa la CACCA ADDOSSOtu sei una CAGNA<URL>",1
1224,SERIAMENTE? MA COSA VUOI KIREI CHE SEI UNA PUTTANONA!!!!!! no kinkshaming solo kinksaming,1
1225,Ma che cazzo ride quella faccia di cazzo di lucia???? si guardasse la sua di faccia anziché offendere fisicamente Aida <URL>,1
1226,ZITTA MERDACCIA.. BOCCA STORTA...COMUNISTa sottosviluppata ....FOGNA SEI UN CANCRo malata psicopatica,1
1227,Sei tu...siete voi la fonte di repressione.....aveste fatto voi almeno un mezza cosa che hanno fatto i fascisti durante il ventennio....avete tolto il lavoro avete tolto i diritti ai lavoratori avete tolto la casa agli italiani.....dovete morire,1
1228,che bella culona potessi vedere come sei davanti mi piacerebbe averti qui è trombarti alla grande e farti toccare il paradiso con un dito,1
1229,Altro che vecchia Signora è ancora un gran pezzo di figa !!!!!!!!!!!!!! <URL>,1
1230,"Bellissima donna... E gran bel pezzo di figa, da gustare tutta mhmm",1
1231,Stai zitta troia,1
1232,RAJE sol culona rigonni,1
1233,Ti lecco tutta porcona messa così ti sborro sulle chiappe,1
1234,<MENTION_4> <MENTION_5> <MENTION_6> <MENTION_7> <MENTION_8> ma non ti vergogni? hai speso una intera giornata della liberazione a offendere <MENTION_9> anziche' commemorare i caduti. Sei una vergog,1
1235,Sei una grande troia svenduta. Chiudi la bocca . Prima di offendere Matteo SAlvini.,1
1236,ti sborro così <URL>,1
1237,Puttana già che sei nera è troppo che ti parlo ti brucio viva,1
1238,"Sotto quale lettera!C cene galanti, corna, corruttore, compravendita senatori?F fagiolini a 80€ al kg?G Gheddafi l'amico e poi inculato come si sa?L lodo Mondadori?M mafioso, Merkel l'inculabile culona?N la nipote di Mubarak?P Putin",1
1239,"non vorrei risultare psicopatica ed infantile, ma: inutile che fate le cagne con mio marito, beccandovi pali atroci, perché mi manda screen e ridiamo di voi. In sintesi è mio, baci baci",1
1240,"TU SEI SOLO UNA LURIDA SCHIFOSA SENZA NESSUNA MORALEVOI CELEBRITA' SAPETE SOLO VIVERE NELLE VOSTRE CASE LUSSUOSE LONTANI DAI PROBLEMI DEI POVERITU SEI UNA IMMORALE SCHIFOSA, UNA DONNA BIDONETORNA NELLA TUA FOGNA MERDA!",1
1241,"Sei una merda che annega in un mare di merde, e io sulle battone come te ci piscio!Ecco una tua foto, impiccati #Merda! <URL>",1
1242,Era un puttanone.,1
1243,SEI UN GRAN PEZZO DI PUTTANONE <URL>,1
1244,"#GF15 Aida di nuovo bullizzata davanti il frigo. Luigi Favoloso hai un c*lo di merda"", Baye: ""sei una cagna"" e altri insulti dalle ragazze.""",1
1245,Facci un favore Asia: cagati in mano e prenditi a schiaffi,1
1246,"<MENTION_4> <MENTION_5> <MENTION_6> <MENTION_7> <MENTION_8> <MENTION_9> Asia Argento, una che avendo un cognome si agita e strepita per farsi un nome.",1
1247,ma quindi non vi avevano impiccati tutti?,1
1248,"#Berlusconi Bisogna avere un governo autorevole. Quando c'ero io, mettevo i veti sulle decisioni che non ci piacevano, e andava bene sia alla culona inchiavabile che a quell'abbronzato di mister Obama. E andrebbe bene pure oggi, a quel franc",1
1249,In questi momenti di pazzia che ha fex tu devi starle vicina..hai capito tettona ? — raga porto una -49 <URL>,1
1250,Ahahahahahah ma vai a fare in culo ebete. Ma cagati in mano e prenditi a schiaffi,1
1251,"Ma cosa va a cercare questa pompinara fallita come moglie ,come madre, come attrice ?",1
1252,Te lo infilerei nel culo facendoti sentire le mie palle che sbattono sulla figa!,1
1253,Esatto vania VIVA LA TETTONA NATURALE!!!,1
1254,Amore sei una gran puttana e ho una gran voglia di godere con te adesso un bel sego e sul tuo bel culo mmmhhhh,1
1255,<MENTION_4> <MENTION_5> <MENTION_6> <MENTION_7> <MENTION_8> <MENTION_9> Ahahahahahah ma cagati in mano e prenditi a schiaffi lurida merda ebete . Fanculo tu i partigiani il 25 aprile e le balle che dic,1
1256,in realtà a lui piace (1) una tettona <URL>,1
1257,oh!! ma sta a vedere che era un androide e non una donna comune!!#mavaiacagaretuequellascrofaacida!,1
1258,Che belle tette fammi una Spagna che ti sborro in....,1
1259,"#Berlusconi potrà anche chiamare Putin o quella culona"" della Merkel, ma nessuno dei due ha potuto riportarlo in Parlamento, perché per quanto tu sia ricco o arrogante, c'è sempre nel mare un pesce più grosso ti te. #MarinaBerlusconi""",1
1260,"RT #Berlusconi potrà anche chiamare Putin o quella culona"" della Merkel, ma nessuno dei due ha potuto riportarlo in Parl…""",1
1261,"<MENTION_4> Perché Asia Argento rappresenta le Donne??? Bel troione, e cocainomane cronica",1
1262,il rapper marito della culona Kardashian <URL>,1
1263,Io prima di lasciarti andare al mare ti scoperei sia in figa che in culo dopo una bella leccata di figa??????,1
1264,Ma stai zitta tettona che lo so che ti piace scopare a te altro che innocente verginella — Non so chi tu sia ma soprattutto che cazzo di problemi hai <URL>,1
1265,"Perche credi che asia argento sia una fautrice rivoluzionaria delle donne? Dopo 20 anni denuncia, ma per favore",1
1266,Beh se asia argento e una donna allora...,1
1267,Che bel culone!!!,1
1268,Sempre meglio che andare in giro con la tua faccia da troia Adorina!,1
1269,<MENTION_4> <MENTION_5> <MENTION_6> <MENTION_7> <MENTION_8> <MENTION_9> <MENTION_10> <MENTION_11> <MENTION_12> <MENTION_13> Ce l'ho già duro te lo sbatterei in quella figa meravigliosa ? naturalmente dopo averla leccata,1
1270,Un puttanone srerile,1
1271,Tranquilla mi seghi coi piedi ma ti sborro in bocca ???,1
1272,Deliziose Tettone Puttanone &lt;3 &lt;3 &lt;3 &lt;3 &lt;3 &lt;3 &lt;3,1
1273,Deliziosa ? pompinara,1
1274,ALLARGATE I SEDILI: ARRIVA LA CULONA – LUFTHANSA PRONTA A PAPPARSI ALITALIA: DEPOTENZIATO FIUMICINO <URL> <URL>,1
1275,E lo so... Però capita di sentire donne che sparlano dicendo che una è una tettona o una è troppo piatta,1
1276,"da come lo usi si direbbe che tettona"" possa avere una accezione negativa, ma questo è impossibile""",1
1277,Ma il termine TETTONA è un complimento supremo! <URL>,1
1278,"Mi confermate?Dare della TETTONA"" a una donna non è universalmente riconosciuto come uno dei più grandi apprezzamenti che si possano fare, ma, addirittura, può avere una accezione negativa? <URL>",1
1279,"RT Mi confermate?Dare della TETTONA"" a una donna non è universalmente riconosciuto come uno dei più grandi apprezzamenti che…""",1
1280,"Chiama Putin per gli affari comuni sul gas, chiama Merkel per chiamarla culona. Silvio farebbe bene a chiudersi in un ospizio",1
1281,wowww mmmmmmmm che tettona,1
1282,madonna quanto sei gelosa tettona <URL>,1
1283,"No, mi faccio io le tipe. Non sono gelosa. E aver uba terza quasi quarta bon è essere tettona.",1
1284,Bella tettona fa sognare e immaginare quello che c'è sotto,1
1285,"ODDIO LA PROVA COSTUME""E poi:- È magra- È alta- Ha un bel culo- È tettona- Fa sport- Dieta- Sua madre è troia""",1
1286,se se mentre tu tu ridi quel grandissimo puttanone di tua mamma sta facendo fruttini a go go per 50 cent.. In piemonte solo gli gianduiotti possono fare,1
1287,"Va benissimo, trovamene una figa con un bel culo sodo!",1
1288,"Ovviamente ti faccio fare tutte le foto che vuoi se mi dai una mascherina, così arricchisci il tuo profilo da gran troia che sei. Mmmmmm gnocca",1
1289,"RT Luigi: “Mia madre ha 47 anni vedessi che culo che c’ha, non come questa merda” (alludendo ad Aida)Baye: “Sei una cagna”D…",1
1290,ancora insulti contro Aida: «Sei una cagna. Zingara».Ma i ragazzi pensano di avere ragione... #gf15,1
1291,Mamma mia ti scoperei culo e figa come se non ci fosse un domani,1
1292,"non c'è pericolo, la figa di legno non fa per me <URL>",1
1293,<MENTION_4> <MENTION_5> In culo la preso quella puttanona di sua madre forse figlio di una troiona immensa.,1
1294,Mai una donna mi ha fatto più schifo di Asia argento. Tutto quello che si ritrova è grazie al paparino. Facile fare i comunisti con i soldi eh Asia ? Anoressica del cazzo,1
1295,io: dai forse non è vero che tutti mi odianotutti: no muori puttana,1
1296,Roberto lascia stare quella figa di legno e gatta morta!!!! Ci sono io!!! #MATRIMONIOAPRIMAVISTA,1
1297,Di non essere tettona???,1
1298,Zio Putin si riposa all' Isola Sant'Angelo di Ischia Capitan Amerika ha ottenuto una promozione verso l' Alto in cui non ci sperava +Eni Nostra e Frau Culona avanzano verso Est sui gasdottiAlfie sta beneTra un po'si torna a votarePerché mi sento inutile?,1
1299,Roberto mettiti con me. Daniela non capisce niente a 28 anni ha la figa di legno peggio di non so cosa. #MATRIMONIOAPRIMAVISTA,1
1300,Alice figa di legno. #lamafiauccidesolodestate,1
1301,"certo, meglio la sinistra amica delle banche che ci deruba dei nostri soldi, vero??? Asia Argento se l'è cercata. E' stata lei la prima a offendere Salvini. Grandissima maleducata. Al futuro Presidente del Consi",1
1302,Presente...ma meglio se me lo meni tu e poi ti sborro ?,1
1303,Nooooooo tu mi vuoi male proprio alloraaa mamma miAaaaaa. Che culooooooooooooooooooo luci che culassoooooooo mamma mia qui tu metterei a pecorina altro che ti scoperei sei una bella figa luci,1
1304,NICKI CULONA SVELA STA SORPRESA E FALLA FINITA OK,1
1305,Ma che splendida lavata di sborra calda mentre il cornuti si sega te lo sbatto tutto dentro la tua gola profonda bevitrice pompinara vogliosa di cazzo ummmmm,1
1306,MACRON È SOLO UN CLOWN IL PINOCCHIO FRANCESE !HA FATTO DIVENTARE PARIGI LA FOGNA MUSLIM EUROPEA! GRAZIE A CULONA MERKEL,1
1307,cagna culona che sei,1
1308,"L'abito contiene a malapena le Deliziose Enormi Naturali Tettone Puttanone e quei Capezzoloni tutti da mordere, succhiare e bere senza sosta...e se dici basta ti prego"" non ti sento &lt;3 &lt;3 &lt;3 &lt;3 &lt;3 &lt;3 &lt;3""",1
1309,Che cazzo gridano ste troie,1
1310,BEL PUTTANONE LATINO DA SBARCO anche un po' indù &lt;3,1
1311,E la culona inchiavabile???,1
1312,Che bella figa ché ai mi piacerebbe leccare tutta amore mio ti scoperei tutta,1
1313,RT Gabriella moglie tettona infedele cerca un nuovo trombamico Gabriella &gt;&gt; <URL> <URL>,1
1314,Tettona con un tipo molto arrapato ! <URL>,1
1315,che bella troia che sei <URL>,1
1316,Sarkozy rideva di noi insieme alla culona inchiavabile...adesso ridiamo noi,1
1317,“brutta coppia schifosa”COME OSI BALDRACCA <URL>,1
1318,ti inculo come Ian fa con Mickey,1
1319,"RT Piccolo Napoleone #Sarkozy era quello che, in compagnia della culona inchiavabile"", irrideva noi, i nostri malcostumi e l…""",1
1320,Ridevano prima d'insediare #Monti..Uno è andato..Ora tocca alla Culona inchiavabile <URL>,1
1321,"Anche la culona è alla canna del gas . Si , i gas di scarico delle auto wolkvagen.????????? <URL>",1
1322,MARTINA PORCA PUTTANA IMPANATA SEI STUPENDA VAFFANCULO STAI ZITTA,1
1323,Grandissima pompinara sei un vero spettacolo,1
1324,ciao Marika buona sera sempre più figa e che bocce che hai da infarto un bacio ?,1
1325,Quello che faceva i sorrisini con la culona ? <URL>,1
1326,Mamma mia che pezzo di figa assurda che sei — Grazie mille ? <URL>,1
1327,"Nonna Merkel mi giunge nuova, non era culona Merkel ?",1
1328,"Quel coglione di Francese in stato di fermo per finanziamenti illeciti dalla Libia, si permetteva di prendere per i fondelli a Berlusconi lui e quella culona di tedesca.",1
1329,Adesso fatte n'altra risata con la culona pezzo di merda,1
1330,Che troia che sei,1
1331,<URL> m'a dit che ride bene chi ride ultimo. Ti piaceva ridere con la culona tedesca? Bombardare la Libia dopo aver incassato? Ridi ridi e.....vaffanculo stronzo!,1
1332,"no è solo che mi mette ansia quando c’ha il mestruo — porca troia, vedi te se mi devo trovare l’esorcista che mi guarda con gli occhi rossi e “ MI FA MALE LA SCHIENA “",1
1333,Non ha molto di cui gioire nemmeno la culona..,1
1334,RT Se sapete cucinare venite a vivere da me. Certo tettona e culona è difficile trovarla. Mi accontento di una che sappia cucinar…,1
1335,"Come sei figa,te lo metterei tutto dentro???",1
1336,"E con il sorrisino, complice la culona, ha voluto pure disarcionare Mr B. Chissà se egli aveva ricevuto qualche confidenza di Muammar ... A Sarko’ posso solo augurare un lungo e costoso processo da colpevole",1
1337,complimenti signora Daniela che bel culone e che meraviglia di buchino da leccare e succhiare anche la cacca . Mmmmm,1
1338,Che puttanata Mi faccio scopate epiche e non sentiamo il bisogno di bestemmiare: che cazzo c’e’ di porco e arrapante in una bestemmia piuttosto che dire “troia ingoia”?,1
1339,Siate pronti a sentire il ruggito della CULONA <URL>,1
1340,Lurida zecca schifosa! Ma peggio ancora chi le permette di parlare in pubblico! MERDE! ??✋?,1
1341,Bianca #Atzei troiona succhiacazzi... Perdipiu' brutta come un cassonetto del pattume #isoladeifamosi,1
1342,mamma mia che bel culone. Chissà se ha un profilo twitter. <URL>,1
1343,ciao lucrezya buona sera e buona serata quanto 6 figa e sexy ti scoperei ?,1
1344,adesso che è arrivata quella che è ancora convinta di valere qualcosa e dimentica le cose dette 5 minuti prima la mia #isola finisce qui#valeriamarini #culona,1
1345,"a quando al gabbio anche la culona ""?""",1
1346,Ora tocca alla culona..Facciamo saltare l'€ e vedi che lacrimoni gli facciamo scendere...,1
1347,Il crimibale sarko non ridecoiuccun la culona della ?,1
1348,Ciao bella tettona un bacio dove piu lo desideri smak,1
1349,#cartabianca Dopo essere stata asfaltata la #merda #bodracca e anche #baldracca si fa vedere in televisione ovviamente dalla #Pdidiota #biancaberlinguer. Senza #ritegno.,1
1350,ti leccobil culo poi ti sborro dentro ti va <URL>,1
1351,"SIGNORA BOLDRINI, A CASA A FARE LA CALZA QUELLO E' IL SUO POSTO <URL>",1
1352,Che simpaticone #sarkozy .... quando rideva con la #culona #inchiavabile.....#adessononridepiú,1
1353,"È tre anni, tre anni che ci stavo assieme, e mi ha lasciata per una sporca puttana! Ok? Che cazzo vuoi? Che cazzo ti ho fatto? <URL>",1
1354,? sonoungrandissimoporco2: Tutto in gola…Troia! <URL>,1
1355,Adesso ridi che mamma ha fatto i gnocchi te con la culona inchiavabile,1
1356,Ora tocca alla culona...,1
1357,"Incredibile come se capiti sul profilo di un puttanone nei suggerimenti ti esce la carrellata di puttanoni, per voi uomini Instagram deve essere proprio un luogo fatato",1
1358,"Bèlla tettona, mi segui !!!!",1
1359,"Ah concludo dicendo che c'avete rotto i coglioni voi e il vostro moralismo immotivato perché NESSUNO sta insultando quel pezzo di figa di ragazza, soprattutto considerando cosa ha passato(E i ritardini haterz che insultano qualsiasi cosa non valgono)",1
1360,Mmmm... bella troia... ti scoperei per ore... come godo bene... vieni a cavalcare il mio cazzone duro!! <URL>,1
1361,Certo che l’inchiavabile culona è ancora lì!,1
1362,"Mi è piaciuto un video di <URL> Marco Travaglio. La vera storia di Berlusconi e della Culona""",1
1363,Bella tettona,1
1364,Poi sarebbe bello ma tanto bello se dopo fosse il turno della culona teutonica... <URL>,1
1365,E quando la culona si leverà anche lei dalle palle!,1
1366,Buongiormo lurida cagna da usare!,1
1367,<MENTION_4> <MENTION_5> <MENTION_6> <MENTION_7> <MENTION_8> <MENTION_9> <MENTION_10> E alla tedesca che gli facciamo? Nulla perché è una “culona inchiavabile”,1
1368,"No, ma sono sicuro che se anche ti stesse venendo davvero, sarebbe un gran bel culone ??",1
1369,"<MENTION_4> <MENTION_5> <MENTION_6> <MENTION_7> <MENTION_8> <MENTION_9> <MENTION_10> <MENTION_11> <MENTION_12> <MENTION_13> Porca puttana!! Smettila lucy!! ??Non è mattina per il tuo culone, come ha",1
1370,Porca puttana ogni mattina 'sta troia non la smette più di parlare,1
1371,Arriverà il giorno che anche la culona smetterà di ridere,1
1372,"Ma vi siete chiesti perché la Culona Inchiavabile"" non ha preso posizione..? Hanno quei famosi ""300MMM di ""Ragioni""... per stare zitti..!!""",1
1373,"eeeh i bei tempi andati di donna schiava, zitta e lava"", quelli sì che erano tempi! <URL>",1
1374,<MENTION_4> No. E' palesemente una figa di legno.,1
1375,fatti inculare cagna vacca troiona con la mia minchia !!,1
