,text,misogynous
2109,porca puttana eva....RIP piccolina...,0
2110,"Non conta una sega vincere 6 scudetti di fila, se poi ammetti apertamente prima della partita che il Real è imbattibile, che per noi è una serata di gala e che l'importante è il campionato.. Che cazzo di mentalità della minchia è questa? Siamo la Juventus, puttana la rana!",0
2111,Porca puttana ti capisco ora più che mai,0
2112,Porca puttana sono in treno dalle 8 e c’è un tizio che non smette di parlare MA NON SPUTI MAI?,0
2113,È UN COUNTDOWN PORCA PUTTANA <URL>,0
2114,porca puttana il primo teaser di LO SIENTO AJKSKSKF,0
2115,"“Figa, ma sul serio giocate con Kuzmanovic in mezzo?”“Ma che cazzo parli che c’avete Bertolacci, almeno noi abbiamo speso poco”Masterlevel anni ‘10.",0
2116,"Porca puttana, si sta svegliando",0
2117,SONO UN PUTTANONE DA SBARCO PER QUESTO ALBUM,0
2118,"come ogni anno è arrivato per me il momento del defollow, ci vediamo l'anno prossimo puttana scrofa lurida",0
2119,Nessuno nota le tue lacrime...Nessuno nota il tuo dolore...Ma porca puttana tutti notano i tuoi errori...,0
2120,Rega ho fame e sonno e in più mi scappa la cacca ma la corriera non passa porca puttana bel ritorno di merda,0
2121,Ma io non posso andare in biblioteca a studiare e trovarmi vicino gente che parla più di mia madre porca puttana stavo a casa allora,0
2122,Ci sta difendere un autistico che spera che il maggior esperto di moda in Italia non capisca che è impossibile che un d&amp;g costi 5000€ porca puttana,0
2123,Porca puttana devo ancora iniziare la tesina,0
2124,"e ancora si riempiono la bocca di magie, di stregonerie.Ma porca puttana non gli basta mai a sta gente.",0
2125,porca puttana.... .. ... . c-cute .. <URL>,0
2126,che palle la scuola il pomeriggio porca puttana lercia ma perché,0
2127,RT #TaehyungArmyLovesYouMa porca puttana ragionate prima di scrivere qualcosa?Vi tirerei tanti di quegli schiaffi che nemmeno d…,0
2128,"porca puttana guarda non dico niente perché tanto so che hai già capito cosa voglio dire, giusto? <URL>",0
2129,"Devi imparare a fare la formazione come Dio comanda, porca puttana! Togli quel cazzo di Buffon, basta con Barzagli! Dybala ammonito cambialo! Bentancur idem! I cambi vanno fatti in tempi utili CRISTO! E ricordat",0
2130,"-quindi, io dico, è giusto bei confronti di una donna tale gesto? Chi siete voi per dare della puttana, troia, zoccola, pompinara, mangiacazzi e così via a una donna? Mettiamola così, vostra madre per voi è una santa non lo metto in dubbio che siete i pri",0
2131,Fatemi vederr giordano porca puttana #uominiedonne,0
2132,ma porca puttana sono stata fino alle tre a fare dei compiti che poi non hanno chiesto,0
2133,"a rega, porca puttana, NON ANDATE DAVANTI AL SUO HOTEL, LASCIATELO IN PACE #harrystylesliveontourBologna",0
2134,"porca puttana, Riposa in Pace.",0
2135,non nominare i serpenti porca puttana mi tocca controllare le coperte ora,0
2136,Raga non è possibile porca puttana,0
2137,"Però porca puttana una metà spesi veramente male, ma quando cavolo ci ricapita di avere tutti quei soldi da spendere, che rabbia ? Si doveva fare meglio!",0
2138,non è stato eliminato vero porca puttana vero <URL>,0
2139,...non ricordo chi tu sia tanto da farmi pensare che da povera frustrata non avendo mai avuto un briciolo di talento ti piace insultare gli altri per gelosia.... Ti consiglio vivamente di trovarti un uomo che ti soddisfi magari saresti me,0
2140,"#TaehyungArmysLovesYouALLORA CAZZONI DI MERDA POTETE TOCCARMI TUTTO MA I BANGTAN NO! PERCHÉ ORA AVETE ROTTO IL CAZZO, MO VENGO LA VI FACCIO TALMENTE MALE CHE GLI OCCHI DAL CULO VR LI FACCIO USCIRE AVETE CAPITO PORCA PUTTANA!!??? VI FACCIO UN CULO QUANTO UNA CASA BASTARDI!!!!!",0
2141,"ma che porcodio stai dicendo coglione!impara il senso delle parole deficiente di una testa di cazzo.solo perché non ti piace la Juventus non devi offendere me e nemmeno la mia famiglia, ma che cazzo hai nella testa? imbecille <URL>",0
2142,Ma Giordano amore mio vieni qua che ti stupro io #uominiedonne,0
2143,Fake woke Twitter user: Giordano ti stupro ioX: Fa notare che è sbagliato a prescindere dire una cosa simileFake woke Twitter: Che pesantezza!! Si chiama ironia!!,0
2144,"Nainggolan manco in panchina perfino in tribuna, mai na gioia porca puttana",0
2145,"Bianca piange sempre e non si prende mai le sue responsabilità, ma porca puttana caccia le palle e dí come la pensi, non nasconderti dietro gli altri. #Isola",0
2146,Ma porca puttana ho iniziato a lavorare da un mese ed è già la seconda volta che mi prendo il mal di gola ma io odio tutto,0
2147,<MENTION_4> Che pena mi vete fatto ridicolizzati dal Real che ha fatto praticamente un allenamento. Avete avuto culo anche <URL> risultato più giusto srebbe stato 6 a 0 pewr il Real. Quando manca l'i,0
2148,"oddio ma cosa cazzo ho letto sotto un post di sfera ebbasta di fandom segretii mio dio ma veramente porca troia avete la merda nel cervello che cazzo dite i gusti personali e il cazzo che vi pare ma non potete farlo passare per una persona con dei contenuti, insieme alle canzoni",0
2149,PORCA PUTTANA STO MALISSIMO <URL>,0
2150,Raga ma io sto una merda porca puttana ma come si fa a tornare a vivere?,0
2151,"#TaehyungArmyLovesYou Mi scuso per le parolacce che sto per scrivere.Porca puttana, la avete un cazzo di vita? Vi fa sccosa? Perfetto. Non commentate e non insultate. Se insultate lui, insultate noi. Noi non critichiamo quello che piace a voi e la cosa deve essere reciproca.",0
2152,"RT #TaehyungArmyLovesYou Mi scuso per le parolacce che sto per scrivere.Porca puttana, la avete un cazzo di vita? Vi fa sccosa?…",0
2153,ma sul serio gli avete augurato la morte? ma state bene? ed è anche vero che non mi dovrei incazzare perché ce n'è di gente con solo mezzo neurone bruciatoma gesù se lo vedesse comincerei a fare un casino assurdoporca puttana connettete bocca e cervello#TaehyungArmyLovesYou,0
2154,PORCA PUTTANA È DAVVERO JOLIN TSAI ANCHE IO VOGLIO INCONTRARE JOLIN TSAI <URL>,0
2155,Porca puttana dobbiamo sempre farci riconoscere eh <URL>,0
2156,Mangiamoceli porca puttana #amala,0
2157,Apro il telefonoTweet di halseyLeggo europeUrlo porca puttanaSfondo il lettoApro la fotoNon c'è l'Italia,0
2158,se halsey non viene in italia la droppo porca puttana,0
2159,HALSEY MANNAGGIA TROIA CHE CAZZO DI EUROPE È QUESTA MI SEMBRI ED SHEERAN DIO POVERO,0
2160,Io mi fidavo di lui ciecamente. È questo che mi ha fregata. Porca puttana,0
2161,NON DIRLO A ME PORCA PUTTANA CHE HO DOVUTO VENDERE IL BIGLIETTO DUE ANNI FA FIGAAAAA HO I SOLDI DI RENZI DA SPENDERE HALSEY CAZZO,0
2162,Si ma sta gente è psicopatica,0
2163,Moo fratello e il suo amico mi hanno fatto sbagliare strada e porca puttana mi hanno fatto fare l'autostrada facendomi pagare 80 centesimi per nulla,0
2164,"Esistono delle basi, DELLE FOTTUTE BASI DALLE QUALI PARTIRE E DEI CONFINI DA NON SUPERARE. Ci sono dei protocolli da seguire, DEI LIMITI OLTRE I QUALI NON SI PUÒ ANDARE, PORCA PUTTANA MAIALA",0
2165,"e la pillola anticoncezionale no, e la pillola del giorno dopo no, e l’aborto no. raga mi sembra di vivere nel medioevo porca puttana",0
2166,"Ma che cazzo aspettate ad andarci senza voltaggi indietro, merde schifose???",0
2167,Un cazzo di link che non si blocca non esista porca puttana handanovic di merda,0
2168,Porca puttana un contropiede non lo facciamo più bene,0
2169,Porca puttana sto bidone di montolivo,0
2170,Porca puttana#MilanInter,0
2171,Mi sono svegliata ora porca puttana ho dormito tutto il pomeriggio,0
2172,PORCA PUTTANA ORA SE NON VI SVEGLIATE,0
2173,Datevi una svegliata porca puttana! Non bisogna avere timore di ste 11 merde cazzo #MilanInter,0
2174,"Gol annullato all' #inter. Porca puttana, ora i milanisti godono ma dobbiamo fare gol adesso #ForzaInter #DerbyMilano",0
2175,"Sto perdendo anni di vita, porca puttana #MilanInter",0
2176,PORCA PUTTANA TROIA #HarryStylesLiveOnTourBologna <URL>,0
2177,Anche in Coppa Italia è andata così. Porca puttana ladra sti sculati di merda,0
2178,"PORCA PUTTANA LADRA SCHIFOSA IERI HARRY STYLES ERA NELLA MIA CITTÀ E IO NON SAPEVO NULLAHARRY STYLES ERA A MODENA E IO LO AVREI POTUTO INCONTRARE, ODIO TUTTI CHE VITA DI MERDA",0
2179,Una stringa in fuorigioco Porca puttana ?,0
2180,Aziendalisti? MA CHE CAZZHAHAHAHAHAHAHAHAHAHAHAHAHAHAPorca puttana ????? Nel 2018 ancora queste merdate? Ma tifa Juventus e non rompere il cazzo con queste stronzate. ????,0
2181,Ha cancellato il link porca puttana,0
2182,Porca puttana ci manca uno forte li davanti...,0
2183,PORCA PUTTANA COSA AVEVA FATTO CUTRONE,0
2184,"-Eli, che cazzo ci fai a casa a quest’ora? Non dovevi staccare alle 21?-Porca puttana Valenti, sta giocando il Milan, è già troppo tardi.#MilanInter",0
2185,Porca puttana,0
2186,Kalinic e Silva invece che uno solo porca puttana..,0
2187,HANNO RIPRESO GIÀ PALLA PORCA PUTTANA,0
2188,"Questi hanno un culo rotto assurdo. Scarsi e culoni, porca puttana.",0
2189,PORCA PUTTANA CAPITANO STI ERRORI!!! ??‍♀️ #MilanInter,0
2190,Ma porca puttana maledetta schifosa ma come cazzo hai fatto a sbagliarla da un metro?,0
2191,Porca puttana hanno più culo che anima,0
2192,"PORCA PUTTANA CHE CAZZO METTE KALINIC CHE NON SERVE AD UN EMERITO CAZZO, QUANDO ENTRA SEMBRA DI FIOCAFE IN 10 E QUELLE VOLTE CHE FA QUALCOSA SBAGLIA PUREEEEE AAAAAAAAAAA",0
2193,"Mauro porca puttana nei hai sbagliati due, non me lo merito",0
2194,schifosi rotti in culo.. mai vista una squadra così culona come il Milan oggi mai,0
2195,"Infatti... mi prendo il punto, ma porca puttana ladra",0
2196,Porca puttana ladra vacca maiala impestata,0
2197,Affidarsi solo ai gol di Icardi comporta questo. Servono due cazzo di attaccanti dai tempi di Jovetic e Ljajc. Porca puttana!,0
2198,Non ci posso credere davvero...Porca troia che sfiga <URL>,0
2199,Mauro ti voglio bene lo stesso ma PORCA TROIA CHE CAZZO HAI FATTO? #MilanInter,0
2200,"Non avere una sola punta degna di tale nome pensa, porca puttana se pesa",0
2201,Adesso continuo a stare con l’ansia addosso porca puttana sono stanca,0
2202,"raga porca puttana che casino che è successo, che porca merda",0
2203,giuro non so che mi succede sento la gente parlare e vorrei far stare tutti zitti è una cosa generale non sopporto le voci porca puttana sta andando avanti da giorni 'sta cosa,0
2204,Porca puttana avete più culo voi che la Kardashian!!! ⚫️????,0
2205,"Assurdo, fino a trenta secondi dalla fine ero sereno, contento del fatto che comunque avevamo giocato una buona partita e che la tanto temuta fregatura nel recupero fosse ormai impossibile.E poi porca puttanaccia schifosa...",0
2206,Ho aspettato 80minuti I due gol del Milan che avevo sentito in radio. Nn so cosa cazzo avessi sentito ma porca puttana maiali quanto girano I coglioni,0
2207,"Piccinini che sfigato,il pistolero,il matador missile terra aria,figa ma come cazzo è messo#BarcellonaRoma",0
2208,"Ma porca puttana, quello era rigore#BarcaRoma",0
2209,Ma vogliamo parlare di quanto sia di cattivo gusto il “contatore dei femminicidi” al TG 2?Il contatore? Ma che cazzo è porca puttana,0
2210,"Passo sul 20. Questi schifosi di Premium non la trasmettono la Roma"". Cerco streaming. Si bloccano. Passo su Telelombardia per 10 minuti, pubblicità. Zapping canale 5. E porca puttana, la fanno qui!""",0
2211,Era vinta sta partita porca puttana..li abbiamo massacrati sti gonzi di merda. Che rabbia.,0
2212,oi raga figa mi sono rotta la minchia di essere sempre la cazzo di sfigata di merda della situazione. indovinate chi domani non vedrà succede? IO PORCA PUTTANA SI PROPRIO IO VAFFANCULO mi butto ora o aspetto?,0
2213,FILIPPO PORCA PUTTANA DUE ACE PROPRIO OGGI NO,0
2214,è dannatamente bello porca puttana #harrystylesliveontourbologna,0
2215,raga lavoro da due (2) giorni e sono già indietro con le serie tv porca puttana che schifo il lavoro,0
2216,"c'hai ragione alessà, se vive na vorta sola, e porca puttana tra tutti noi eri forse l'unico che nse meritava de lascià sto mondo così presto, te che c'avevi ottomila piani pe il futuro, te che nte ncazzavi mai co nessuno",0
2217,col cazzo che gli scrivo ahaha ceh va bene ho fatto la stronza ma lui ancora di più stronzo troione da combattimento daddy baldracco puttanone zoccolo da corsa,0
2218,Gli dite a De rossi gioca con la Roma no col Barcellona porca puttana !!!!!!!!,0
2219,"Stessa cosa di ieri, porca troia anche voi che cazzo vuol dire farla a quell’ora ahahahahah",0
2220,"Rossa tu nn ci azzacchi nulla"" ti sei ritrovata in mezzoCome alcuni de loro Ah ""inculo alla balena""(So che leggete )""",0
2221,E voi porca puttana dovete protestare cazzo! Quando succedono ste cose si va in 10 intorno a quella merda con l giacchetta gialla,0
2222,Ma come cazzo fai a non applaudire un gol del genere.... è normale! È spontaneo.....porca puttana,0
2223,"E allora non sorridere, porca puttana.",0
2224,porca puttana mi manca Jonghyun,0
2225,Ma vaffanculo che culo dimmerda porca puttana dai,0
2226,STIAMO PERDENDO DUE A ZERO PER DUE AUTOGOL MA CHE CAZZO STO VEDENDO PORCA PUTTANA,0
2227,DUE AUTOGOL DI MERDA. MA PORCA PUTTANA #BarcaRoma,0
2228,Piasse per culo da soli porca puttana!!! Stanno a gioca co Barcellona,0
2229,"Non è possibile sta sfiga,altro autogol,porca puttana",0
2230,porca di quella puttana santa mi sono spoilerata tokyo ghoul ma uno spoiler gigante che cazzo lo scrivono tra parentesj se è così. Importante,0
2231,Porca puttana mi farà morire lo so. <URL>,0
2232,"2 autogol e Pique. Porca puttana ladra, Dio non può esistere, fanculo",0
2233,Ma voi figli di troia senza juventus non sapete che cazzo scrivere? Contenti voi <URL>,0
2234,Non sono una appassionata di calcio ma...porca puttana #BarcaRoma,0
2235,"Porca puttana ..ma chi sei Di Francesco qualsiasi per andare al Camp Nou e sul 2-0 ti fai beccare in contropiede contro giocatori come Leo,Il Mago,Suarez ....chi sei??tu che che non hai vinto nulla.Aspetta e cerca con calma un goal in trasferta piagnucoloso !",0
2236,ho sonno e sono ancora dannatamente fuori ma chi me lo fa fare a uscire ma porca puttana,0
2237,"Ieri una commessa mi ha dato della tettona, “Ah Signó la sostanza c’è “Non entrerò mai più in un negozio Diesel se non con commessi uomini.",0
2238,Cara puoi spiegare a come si exit dall’Europa almeno ci lasciate qualcosa anche a noi.... porca puttana!?#BarcaRoma,0
2239,<URL> CAZZO CHE ROBA PORCA PUTTANA,0
2240,"brava brava entra nel lato oscuro e ultima tutti gli NCT &gt;:]] — PORCA PUTTANA QUANTO MI STO PREOCCUPANDONo no no, ecco io gli NCT non volevo stannarli proprio p... <URL>",0
2241,PORCA PUTTANA PORCA PUTTANA CHE CAZZO HA PARATO TER STEGEN,0
2242,"Porca troia lurida, non voleva entrà Dio Madonna",0
2243,?????porca puttana come stamo,0
2244,Scena spettacolo!questa dell'accendino porca puttana!,0
2245,"mia sorella, genio, invece di chiedere personalmente a me se lo volessi o meno, ha chiesto a mia mamma: dici che martina lo vuole?"" e mia mamma ovviamente ha risposto ""no dai ha già l'altro che funziona""cioè ho praticamente la batteria andata a puttane ma fa niente""",0
2246,Ma che cazzo ho in testa porca di quella troia non riesco più a controllarmi,0
2247,E mettetela sta cazzo di Var in Europa porca puttana. O non la mettono altrimenti Barca e Real non vincono + ? L’anno scorso col Psg in casa il Barca è stato stra-aiutato dall’arbitro. Questa sera contro la Roma pure uno schifo.,0
2248,"Nei drama ci sono alcuni personaggi femminili così stupidi ma COSÌ STUPIDI che porca troia gli schiaffi, sono irritanti",0
2249,"Sintesi: Barcellona culona, De Rossi come CR7. Entrambi applauditi dai tifosi avversari. #BarcaRoma #BarcellonaRoma",0
2250,"Avessimo vinto oggi, porca puttana...",0
2251,"Secondo me ve la cercate da soli, non è possibile che non capiate determinate cose e non è possibile che rompete così tanto i coglioni. Trovatevi qualcosa da fare porca puttana e lasciate la gente in pace",0
2252,PORCA PUTTANA VOGLIO QUESTO VIDEO COME PINNED <URL>,0
2253,"Cereali e basta?Ma porca puttana gioia mia, svegliati!?#chilhavisto",0
2254,raga ma QUANTO CAZZO ERA BELLO CON QUEL COMPLETO ROSA PORCA PUTTANA #HarryStylesLiveOnTourbologna,0
2255,"Ma non solo lui eh, anche sua sorella. E sono così stanca porca puttana, così stanca di essere così diversa. Io sono sempre quella che viene derisa nelle cose, sempre. Sempre messa al secondo posto, trattata male, battutone del cazzo dove solo loro ridono e hanno un idea di me +",0
2256,"Così sbagliata che sembra che in tutti questi anni non siano nulla. Sette quasi otto anni di amicizia e sembra che non capiscono un cazzo di me, con tutto che io gli ho sempre dato me stessa. Sempre. In ogni situazione. E lui porca puttana, prima dice una cosa e poi +",0
2257,DIO BENEDICA IL MIO NASO CHE È L'UNICA COSA DECENTE CHE HO E CHE MIA MAMMA MI HA PASSATO ANCHE SE LEI È RUSSA E QUINDI FIGA DAL PRINCIPIO E POTEVA PASSARMI PIÙ GENI DELLA FIGAGGINE MA VABBÈ DAI <URL>,0
2258,porca puttana,0
2259,"L'errore di Gonalons mi torna in mente quando mi distraggo, come un flash. Che mazzata, porca puttana ragazzi. Incredibile. Conoscevo un giocatore differente, l'opposto di questo qua. Mah",0
2260,sento che sta per venirmi un gran mal di testa porca puttana voglio morire <URL>,0
2261,"Spero che a tutti sia chiaro chi è questo figlio di puttana. E nessuno mi cago il cazzo per l'insulto, perché l'unico insulto è chi sfrutta le paure dei tifosi per cercare di attirare l'attenzione",0
2262,porcoddioooooo non entravo su whatsapp da mezz’ora e neanche mi serviva ma ci sono entrata un secondo ora per una cosa e papà mi ha scritto “non fare tardi” mannaggia la troia mi becca sempre ma che cazzo ha le spie.,0
2263,Continuo a guardare quella foto. Porca puttana che male.,0
2264,"Ogni volta che leggo se l'è cercata provo schifo. La #violenza non si cerca, è lei che cerca te.",0
2265,alla guerra fredda dei #Dazi rispondiamo con accordi bilaterali con sia con cina che trump come manco la peggio puttanona!!,0
2266,"Ehi Jules, e #SeImparassimo a guardare l'orizzonte con gli occhi speranzosi dell'esploratore?""""Porca puttana Luke, l'ultimo mio barlume di speranza si è spento nel momento in cui ho realizzato che non mi pagherai mai tutte le birre che hai bevuto.""#unTemaAlGiorno""",0
2267,"RT Ehi Jules, e #SeImparassimo a guardare l'orizzonte con gli occhi speranzosi dell'esploratore?""""Porca puttana Luke, l'ult…""",0
2268,Spenderò poche parole riguardo la trasferta di ieri a Benevento:PORCA PUTTANA CHE SONNO,0
2269,La mattina dopo mi sveglio con la consapevolezza e la tranquillitá che l'Inter é un sqMAURITO PORCA PUTTANA COSA TI SEI MAGNATOOOOOOO,0
2270,Farà puttanone ma con la frangia stavo bene...io....?? <URL>,0
2271,perché non sono nata donna porca puttanaa causa del ciclo ho un mal di pancia e un mal di testa orribileVOLEVO CHIAMARMI PINO IO,0
2272,La gente non solo ti fa incazzareMa poi ti lascia anche in visualizzato porca puttana<MENTION_1> sto per ammazzare bollettaLo odio,0
2273,Che schifo il ciclo porca puttana a a a a a,0
2274,porca puttana quelle che sono qua al lavoro con me mi trattano come una rincoglionita,0
2275,STIAMO SCHERZANDO?????? IO CI DEVO ANDARE SUBITO TAYLOR. DEMI. SHAWN. JAMES. NIALL. LIAM. ED. CAMILA. HAILEE. SAM. RAGA PORCA PUTTANA <URL>,0
2276,"Non me la levo dalla testa quell’immagine porca puttana,forse anche perché so che domenica difficilmente vinceremo visto anche che forse giocherà nonno Valero e non Rafinha",0
2277,"Già il mondo è pieno di criminali, egoisti e pazzi che si distruggono da se'. Almeno lasciamo stare il #mare, lasciamo stare questa meraviglia. Porca puttana! <URL>",0
2278,che giornata del cazzo porca puttana è da stamattina che non me ne va bene una e sta continuando ad andare così ma io oggi mi ammazzo,0
2279,Devo tornare come quella di prima e se dovesse essere necessario inizierò a fare addominali anche quando sono a letto porca puttana.,0
2280,Ce le avete presenti le sufficienze in fisica? Io no. Porca puttana.#seialloscientifico,0
2281,"quelle Puttane delle mie compagne TUTTO IL TEMPO hanno preso per il culo un ragazzo di un'altra classe perché si é truccato e dicevano che faceva schifo e??????? cosa?????? ma siamo nel medioevo o cosa? oppure hanno detto é frocio ma non é gay"" CHE CAZZO SIGNIFICA MADONNA MI""",0
2282,"E neanche qua hai la certezza, porca puttana",0
2283,"Non me ne frega un cazzo di fare anche il tuo lavoro se hai bisogno, ma queste telefonate di merda le fai tu, porca puttana visto che eri TU d’accordo. E non me ne frega un cazzo se a 33 anni non ti piace telefonare.",0
2284,"Sto guardando i video del concerto e il mio oh porca puttana ora crepo"" prima che si esibisse con 'If I could fly' è pura poesia.""",0
2285,#HarryStylesLiveOnTourBologna l'esperienza più bella della mia vita. Porca puttana,0
2286,Ogni volta che guardo l’entrata del concerto mi metto a piangere e a ridere perché rivivo tutte le emozioni ma sento anche il “porca puttana” di Alessia e quindi sfaso,0
2287,"Non è scomparsa, è invisibile, porca puttana… <URL>",0
2288,"Che schifo, che vergogna. Mi fanno schifo tutti. E per la nostra povera Pamela fatta a pezzi? Non si è mosso nessuno femministe incluse e neanche 1 € alla famiglia. Mi fate schifo, mi fate venire il vomito. PRIMA GLI ITALIANI",0
2289,"non capisco perchè quando parlo con nymphis mi si blocca la chat, tastiera, il telefono, premo invio per mandare il messaggio e si blocca lo schermo, il telefono, la vitaesco dalla sua chat e tutto nornale PORCA PUTTANA .",0
2290,non ho mangiato niente porca puttana,0
2291,"Ma perché la gente con una visione unilaterale delle cose ci tiene tanto a coinvolgerti nei suoi discorsi o infilarsi nei tuoi? Porca troia io amo discutere quando ogni interlocutore dà il suo apporto, ma se trasformi ogni cosa in un vicolo cieco che cazzo vuoi, parla da solo",0
2292,Comunque voi che cantavate a squarcia gola e stonavate di brutto e non mi avete fatto sentire/registrare un cazzo durante Sweet Creature e If I Could Fly potete pure soffocare con la vostra stessa saliva ERANO LE MIE CANZONI PREFERITE PORCA PUTTANA,0
2293,dipende che famiglia di merda hanno che cazzo ci prendono nei carabinieri o nella polizia?,0
2294,"e sì porca puttana, se mi chiedi hai pregiudizi verso i papà ex-carcerati?"" io ti rispondo ""sì"" con una foga che manco stessi cantando l'inno nazionale, inutile che mi segui per 30 metri""",0
2295,Porca puttana mi sembri una di quelli che alle medie mi tiravano le pizzette quando mi vedevano mangiare qualcosa solo per il gusto di vedermi piangere,0
2296,"non supporto nessuna idea xenofoba né aporofoba ma porca puttana un minimo di pulizia, anche per tutelare chi ha bisogno veramente, ci vorrebbe",0
2297,"Il momento che aspetto tutti gli anni è arrivato anche quest'anno, porca puttana! Perchè ogni anno quando tutti credono di essere i migliori, mio fratello Cosimo arriva e li manda a casa sempre, come se fosse normale!",0
2298,porca puttana ma questa??? il sogno di una vitaaa <URL>,0
2299,la gente non mi capisce proprio porca puttana,0
2300,quanto fate schifo ma che cazzo volete fatevi una vita <URL>,0
2301,"Ma poi scusate, signori capi di stato vigliacchi.. Vi confrontate con i giornali a distanza? Putin ha giurato che prenderà a calci nel culo i capi europei.. È comincerà dalla culona e di quello scolonnato di gentiloni..",0
2302,ITALY PORCA PUTTANA LURIDA,0
2303,RT PORCA PUTTANA CE LA FATEEEEE,0
2304,"Non fare la figa di legno, mica ti sei trasferito a Milano! ?",0
2305,CAPISCO CHE ABITO IN CAMPAGNA MA PORCA PUTTANA I RAGNI VERDI NO,0
2306,e porca puttana aggiungerei io <URL>,0
2307,PORCA PUTTANA IO NON,0
2308,"<MENTION_4> Oh pirla e quindi? Quelli che hanno fatto il servizio sulla vostra curva, rappresentano tutta la nazione? Che cazzo di ragionamenti fate porca troia!",0
2309,PORCA PUTTANA MA NON TI PARE UN PO' PRESTO BIGHIT,0
2310,Porca puttana dobbiamo fargli il culo... nero nero,0
2311,RAGA STO PIANGENDO MI HANNO RIPORTATO GLI HIGHLIGHT REEL PORCA TROIA SONO IN UN BAGNO DI LACRIME CHE CAZZO DID7DUDH,0
2312,"Ma porca puttana, mi salta anche Dirk",0
2313,"Veramente ma porca puttana, ma dobbiamo farci ridere dietro a ogni cazzo di giorno.",0
2314,In questi giorni ho giocato il mondiale su fifa con mio fratello. Risultato : Francia culona campione del mondo contro l'outsider Serbia. Miglior marcatore del torneo Ruidiaz del Perù con 9 centri. <URL>,0
2315,"Poi si lamentano che la gente fa incidenti, ovviamente non sapete guidare porca puttana",0
2316,"#Euphoria un cazzo, io sto piangendo porca puttana",0
2317,Anche solo qui su Twitter va bene che poi lo andiamo a cercare noi. Porca puttana!!,0
2318,Porca puttana odio sta cazzo di metro/treno dove non prende manco a pregare in ginocchio,0
2319,porca puttana siamo solo a due teaser per le track e adoro già questo album <URL>,0
2320,Ma allora che cazzo ci stanno a fare questi puttana la madonna!!! Ok che ci guadagnano col Business e tutto ma se la squadra continua a far cagare è inutile pure per loro!!! Proprio non capisco,0
2321,"the first time I saw you, my heart whispered ‘ nO PORCA PUTTANA LUI È MIN YOONGI FA PARTE DEL GRUPPO CHE TI FARÀ MANDARE TUTTO A PUTTANE SCAPPA FINCHÈ PUOI ‘#Euphoria <URL>",0
2322,"AHHH! sono sul poggiolo (con i pantaloni del pigiama natalizio (lol) e una maglia di mio cugino, le pantofole) passa uno in macchina e mi urla “bella figa” MA CHE CAZZO DI PROBLEMI HAI!! Coglione. Chi ti da il permesso di urlarmi “complimenti” tieniteli per te i tuoi pensieri",0
2323,PORCA PUTTANA LAIDA MANNAGGIA AI BTS CRISTO SANTISSIMO,0
2324,"Ogni volta che qualcuno definisce Raul Bova ATTORE, Tognazzi risorge per prenderlo a schiaffi, senza che il signor qualcuno sia necessariamente affacciato al finestrino di un treno.",0
2325,"porca puttana pure un articolo su sta cosa, se domani ha ancora il posto di lavoro la tipa è fortunata e tanto <URL>",0
